title,level,category,content,translation,source,tags
The Power of Active Recall,B1,study-skills,"Many students spend hours rereading notes, but they remember little after a week. Active recall is different. Instead of looking at the answer, you try to pull information from memory. This effort strengthens neural connections and improves long-term retention. A simple way to practice is to close your notebook and explain the topic in your own words. If you get stuck, reopen the material, review briefly, and test yourself again. Over time, your brain learns that information must be ready for use, not just familiar on the page.","许多学生花很多时间反复看笔记，但一周后仍记不住多少内容。主动回忆则不同。你不是看答案，而是主动从记忆中提取信息。这种努力会强化神经连接，提升长期记忆。一个简单方法是合上笔记本，用自己的话讲解知识点。卡住时再短暂回看资料，然后继续自测。久而久之，大脑会学会把信息变成可调用的能力，而不是纸面上的熟悉感。",english-flashcards,memory|study
How Sleep Supports Learning,B1,health-learning,"People often cut sleep to gain extra study time, yet this strategy can backfire. During sleep, the brain processes and organizes what you learned in the day. It strengthens important memories and removes unnecessary information. Without enough rest, attention drops, reaction time slows, and mistakes increase. Experts suggest keeping a regular sleep schedule and reducing screen exposure before bed. Even small changes, such as sleeping thirty minutes earlier, can improve next-day focus and recall.","很多人为了多学习而压缩睡眠，但这种做法常常适得其反。睡眠期间，大脑会整理并加工白天学到的内容，强化重要记忆并清理无用信息。睡眠不足会导致注意力下降、反应变慢、错误增多。专家建议保持规律作息，并在睡前减少屏幕使用。即使只是提前三十分钟入睡，也可能显著提升第二天的专注与回忆能力。",english-flashcards,sleep|learning
A Short History of Public Libraries,B2,culture,"Public libraries were created to make knowledge accessible to everyone, not only to wealthy people. In many cities, libraries became centers for reading, research, and community events. As technology developed, libraries added computers, digital archives, and online borrowing services. Today, a library is more than a room full of books. It is a public space where people can study quietly, attend workshops, and explore new ideas. Although reading habits have changed, the core mission remains the same: equal access to information.","公共图书馆的建立是为了让所有人都能获取知识，而不仅仅是富人。在许多城市，图书馆逐渐成为阅读、研究和社区活动中心。随着技术发展，图书馆加入了电脑、数字档案和线上借阅服务。今天，图书馆已不只是“装满书的房间”，而是人们安静学习、参加讲座、探索新想法的公共空间。尽管阅读习惯发生了变化，其核心使命没有变：让信息公平可得。",english-flashcards,history|culture
Why Cities Need Green Spaces,B2,environment,"Urban life is convenient, but it can also be stressful and crowded. Parks, riverside paths, and small community gardens help balance city life. Green spaces improve air quality, reduce noise, and lower summer temperatures. They also encourage exercise and social interaction. Research shows that regular contact with nature can reduce anxiety and improve mood. For children, outdoor environments support curiosity and healthy development. Designing greener neighborhoods is not only an environmental decision; it is also a public health investment.","城市生活很便利，但也可能带来拥挤与压力。公园、河边步道和社区小花园能为城市生活带来平衡。绿地可以改善空气质量、降低噪音并缓解夏季高温，还能促进运动和社交。研究表明，规律接触自然有助于减少焦虑、改善情绪。对儿童来说，户外环境也能支持好奇心与健康成长。建设更绿色的社区不仅是环保选择，也是公共健康投资。",english-flashcards,environment|city
The Role of Curiosity in Innovation,B2,thinking,"Innovation often starts with a simple question: why does this work this way? Curious people challenge assumptions and explore possibilities others ignore. They observe patterns, test ideas, and learn from failure. In teams, curiosity creates better conversations because members ask clarifying questions instead of defending fixed opinions. Companies that reward experimentation usually adapt faster to change. Curiosity does not guarantee success, but it increases the chance of discovering useful solutions.","创新往往始于一个简单问题：为什么它会这样运作？有好奇心的人会挑战既有假设，探索他人忽略的可能性。他们观察规律、验证想法、并从失败中学习。在团队中，好奇心能带来更高质量的讨论，因为成员更愿意澄清问题，而不是固守立场。鼓励试验的公司通常也更能适应变化。好奇心不能保证成功，但能提高找到有效解决方案的概率。",english-flashcards,innovation|mindset
Digital Minimalism in Daily Life,B2,lifestyle,"Digital tools save time, but constant notifications can fragment attention. Digital minimalism means using technology with intention instead of habit. You can start by identifying which apps truly support your goals. Then disable nonessential alerts and set specific time windows for messages. Many people find that fewer interruptions lead to deeper work and calmer evenings. The aim is not to reject technology, but to make it serve your priorities.","数字工具能提高效率，但持续通知会切碎注意力。数字极简主义强调有目的地使用技术，而不是被习惯牵着走。你可以先识别哪些应用真正支持你的目标，再关闭不必要提醒，并为消息处理设定固定时间。很多人发现，打断更少后，工作更深入，晚间也更平静。目标不是拒绝技术，而是让技术服务于你的优先事项。",english-flashcards,productivity|lifestyle
Learning Through Teaching,B1,study-skills,"One effective way to master a topic is to teach it to someone else. Teaching forces you to organize ideas, identify gaps, and explain concepts clearly. If you cannot explain a point simply, you may not fully understand it yet. This method works even when you study alone. Imagine you are giving a short lesson, speak out loud, and use examples from daily life. The process turns passive reading into active thinking.","掌握一个主题的有效方法之一是把它讲给别人听。教学会迫使你整理思路、发现漏洞，并清晰表达概念。如果你无法把一个观点简单说明，往往意味着你还没完全理解。即使独自学习，这个方法也有效。你可以想象自己在做一段小课堂，开口讲解并结合生活例子。这个过程会把被动阅读转化为主动思考。",english-flashcards,learning|teaching
The Economics of Small Decisions,B2,economics,"People often think financial outcomes depend only on major choices, such as buying a house or changing jobs. In reality, repeated small decisions also matter. Daily spending habits, subscription management, and automatic savings can shape long-term results. Behavioral economists note that convenience strongly influences choices. When saving is easy and default, people save more. Designing better personal systems can be more effective than relying only on willpower.","很多人认为财务结果只取决于大决定，比如买房或换工作。实际上，反复出现的小决定同样重要。日常消费习惯、订阅管理和自动储蓄都会影响长期结果。行为经济学指出，“便利性”对选择影响很大：当储蓄机制更简单、默认开启时，人们更容易存下钱。设计更好的个人系统，往往比单纯依靠意志力更有效。",english-flashcards,economics|decision
Can Technology Replace Teachers,B2,education,"Online platforms, AI tools, and adaptive software have transformed modern classrooms. They can personalize exercises, provide instant feedback, and expand access to quality resources. However, technology cannot fully replace teachers. Good teachers build trust, motivate students, and respond to emotional needs that software may miss. The most effective model is usually blended learning: technology handles routine practice while teachers guide discussion, critical thinking, and collaboration.","在线平台、AI 工具和自适应软件正在改变现代课堂。它们可以个性化练习、提供即时反馈，并扩大优质资源的可及性。然而，技术无法完全取代教师。优秀教师能够建立信任、激励学生，并回应软件可能忽视的情感需求。通常最有效的是混合式学习：技术负责常规练习，教师负责讨论引导、批判思维与协作能力培养。",english-flashcards,education|ai
From Motivation to Discipline,B1,mindset,"Motivation feels powerful, but it is often unstable. Some days you feel energetic, and some days you do not want to start. Discipline helps bridge this gap. It means doing the planned task even when enthusiasm is low. Building discipline is easier with clear routines, small goals, and visible progress tracking. Once a behavior becomes automatic, it requires less mental effort. In the long run, discipline creates consistency, and consistency creates results.","动力很强大，但通常不稳定。有些天你状态很好，有些天却根本不想开始。自律能弥补这种波动。它意味着即使热情不高，也按计划完成任务。建立自律更容易的方法是：明确流程、拆小目标、可视化记录进度。一旦行为变得自动化，所需心理能量就会减少。从长期看，自律带来稳定，稳定带来结果。",english-flashcards,motivation|discipline
